{
  "version": 2,
  "id": "fallout-2",
  "name": "Fallout 2 — Pip-Boy 2000",
  "description": "A hardware-inspired Pip-Boy 2000 layout with a control rail, CRT display, and full-color character art.",
  "platforms": {
    "gnome": {
      "stylesheet": "theme.css",
      "layout": "pipboy-2000"
    },
    "macos": {
      "layout": "pipboy-2000",
      "palette": {
        "background": "#090D0AFF",
        "surface": "#121A13FF",
        "primary": "#B9D8A6FF",
        "secondary": "#7D9D70FF",
        "text": "#E6E0C0FF",
        "muted": "#9A987EFF",
        "warning": "#D7A83EFF",
        "critical": "#C84C3CFF"
      },
      "typography": {"family": "monospaced", "scale": 1.0}
    }
  },
  "art": {
    "good": "assets/animation/good/32.png",
    "worried": "assets/animation/worried/32.png",
    "critical": "assets/animation/critical/32.png",
    "dead": "assets/animation/dead/16.png"
  },
  "panelArt": {
    "good": "assets/panel/good.png",
    "worried": "assets/panel/worried.png",
    "critical": "assets/panel/critical.png",
    "dead": "assets/panel/dead.png"
  },
  "frameAnimation": {
    "intervalMs": 28,
    "playback": "once",
    "frames": {
      "good": [
        "assets/animation/good/1.png", "assets/animation/good/2.png",
        "assets/animation/good/3.png", "assets/animation/good/4.png",
        "assets/animation/good/5.png", "assets/animation/good/6.png",
        "assets/animation/good/7.png", "assets/animation/good/8.png",
        "assets/animation/good/9.png", "assets/animation/good/10.png",
        "assets/animation/good/11.png", "assets/animation/good/12.png",
        "assets/animation/good/13.png", "assets/animation/good/14.png",
        "assets/animation/good/15.png", "assets/animation/good/16.png",
        "assets/animation/good/17.png", "assets/animation/good/18.png",
        "assets/animation/good/19.png", "assets/animation/good/20.png",
        "assets/animation/good/21.png", "assets/animation/good/22.png",
        "assets/animation/good/23.png", "assets/animation/good/24.png",
        "assets/animation/good/25.png", "assets/animation/good/26.png",
        "assets/animation/good/27.png", "assets/animation/good/28.png",
        "assets/animation/good/29.png", "assets/animation/good/30.png",
        "assets/animation/good/31.png", "assets/animation/good/32.png"
      ],
      "worried": [
        "assets/animation/worried/1.png", "assets/animation/worried/2.png",
        "assets/animation/worried/3.png", "assets/animation/worried/4.png",
        "assets/animation/worried/5.png", "assets/animation/worried/6.png",
        "assets/animation/worried/7.png", "assets/animation/worried/8.png",
        "assets/animation/worried/9.png", "assets/animation/worried/10.png",
        "assets/animation/worried/11.png", "assets/animation/worried/12.png",
        "assets/animation/worried/13.png", "assets/animation/worried/14.png",
        "assets/animation/worried/15.png", "assets/animation/worried/16.png",
        "assets/animation/worried/17.png", "assets/animation/worried/18.png",
        "assets/animation/worried/19.png", "assets/animation/worried/20.png",
        "assets/animation/worried/21.png", "assets/animation/worried/22.png",
        "assets/animation/worried/23.png", "assets/animation/worried/24.png",
        "assets/animation/worried/25.png", "assets/animation/worried/26.png",
        "assets/animation/worried/27.png", "assets/animation/worried/28.png",
        "assets/animation/worried/29.png", "assets/animation/worried/30.png",
        "assets/animation/worried/31.png", "assets/animation/worried/32.png"
      ],
      "critical": [
        "assets/animation/critical/1.png", "assets/animation/critical/2.png",
        "assets/animation/critical/3.png", "assets/animation/critical/4.png",
        "assets/animation/critical/5.png", "assets/animation/critical/6.png",
        "assets/animation/critical/7.png", "assets/animation/critical/8.png",
        "assets/animation/critical/9.png", "assets/animation/critical/10.png",
        "assets/animation/critical/11.png", "assets/animation/critical/12.png",
        "assets/animation/critical/13.png", "assets/animation/critical/14.png",
        "assets/animation/critical/15.png", "assets/animation/critical/16.png",
        "assets/animation/critical/17.png", "assets/animation/critical/18.png",
        "assets/animation/critical/19.png", "assets/animation/critical/20.png",
        "assets/animation/critical/21.png", "assets/animation/critical/22.png",
        "assets/animation/critical/23.png", "assets/animation/critical/24.png",
        "assets/animation/critical/25.png", "assets/animation/critical/26.png",
        "assets/animation/critical/27.png", "assets/animation/critical/28.png",
        "assets/animation/critical/29.png", "assets/animation/critical/30.png",
        "assets/animation/critical/31.png", "assets/animation/critical/32.png"
      ],
      "dead": [
        "assets/animation/dead/16.png"
      ]
    }
  }
}
